{
  "$schema": "http://json-schema.org/draft-07/schema#",
  "title": "Spelling Bee Word Entry",
  "type": "object",
  "required": ["word", "tier", "respelling", "partOfSpeech", "origin", "definition", "sentence"],
  "additionalProperties": false,
  "properties": {
    "word": {
      "type": "string",
      "description": "The word to be spelled. Lowercase unless a proper noun. Single word only - no spaces or hyphens.",
      "pattern": "^[a-zA-Z]+$"
    },
    "tier": {
      "type": "integer",
      "minimum": 1,
      "maximum": 8,
      "description": "Difficulty tier, which maps 1:1 onto the round number."
    },
    "respelling": {
      "type": "string",
      "description": "Plain-English phonetic respelling with the stressed syllable in CAPS, e.g. 'kuh-TAS-truh-fee'. No IPA."
    },
    "partOfSpeech": {
      "type": "string",
      "enum": ["noun", "verb", "adjective", "adverb"]
    },
    "origin": {
      "type": "string",
      "description": "Short language of origin, read aloud verbatim by the pronouncer."
    },
    "definition": {
      "type": "string",
      "description": "One concise sentence. Must NOT contain the word itself or an obvious cognate giveaway."
    },
    "sentence": {
      "type": "string",
      "description": "A short, natural sentence using the word."
    },
    "alsoAccepted": {
      "type": "array",
      "items": { "type": "string" },
      "default": [],
      "description": "Alternate spellings that must be ruled correct. Shown to the pronouncer as a warning."
    },
    "notes": {
      "type": "string",
      "description": "Optional guidance for the pronouncer (homophone traps, alternate pronunciations, etc.)."
    }
  }
}
