[
  { "word": "synecdoche", "tier": 6, "respelling": "sih-NEK-duh-kee", "partOfSpeech": "noun", "origin": "Greek", "definition": "A figure of speech in which a part stands for the whole.", "sentence": "Calling a car a set of wheels is a synecdoche." },
  { "word": "apocryphal", "tier": 6, "respelling": "uh-POK-ruh-fuhl", "partOfSpeech": "adjective", "origin": "Greek", "definition": "Widely circulated but probably untrue.", "sentence": "That story about the founder is apocryphal." },
  { "word": "cynosure", "tier": 6, "respelling": "SY-nuh-shoor", "partOfSpeech": "noun", "origin": "Greek", "definition": "A person or thing that is the center of attention.", "sentence": "She was the cynosure of the whole gallery." },
  { "word": "eleemosynary", "tier": 6, "respelling": "el-uh-MOS-uh-nair-ee", "partOfSpeech": "adjective", "origin": "Greek", "definition": "Relating to charity or the giving of alms.", "sentence": "The trust serves a purely eleemosynary purpose." },
  { "word": "amanuensis", "tier": 6, "respelling": "uh-man-yoo-EN-sis", "partOfSpeech": "noun", "origin": "Latin", "definition": "A person who writes down what another dictates.", "sentence": "The blind poet worked with an amanuensis." },
  { "word": "adumbrate", "tier": 6, "respelling": "AD-uhm-brayt", "partOfSpeech": "verb", "origin": "Latin", "definition": "To outline or foreshadow in a sketchy way.", "sentence": "The memo adumbrates a larger reorganization." },
  { "word": "anodyne", "tier": 6, "respelling": "AN-uh-dyn", "partOfSpeech": "adjective", "origin": "Greek", "definition": "Inoffensive to the point of being bland.", "sentence": "The statement was deliberately anodyne." },
  { "word": "casuistry", "tier": 6, "respelling": "KAZH-oo-ih-stree", "partOfSpeech": "noun", "origin": "Latin", "definition": "Clever but unsound reasoning, especially about morality.", "sentence": "The argument collapsed into casuistry." },
  { "word": "contretemps", "tier": 6, "respelling": "KON-truh-tahn", "partOfSpeech": "noun", "origin": "French", "definition": "An unexpected and awkward mishap.", "sentence": "A minor contretemps delayed the ceremony." },
  { "word": "crepuscular", "tier": 6, "respelling": "krih-PUS-kyuh-ler", "partOfSpeech": "adjective", "origin": "Latin", "definition": "Relating to twilight, or active at dusk.", "sentence": "Deer are largely crepuscular animals." },
  { "word": "desuetude", "tier": 6, "respelling": "DES-wih-tood", "partOfSpeech": "noun", "origin": "Latin", "definition": "A state of disuse.", "sentence": "The law fell into desuetude decades ago." },
  { "word": "encomium", "tier": 6, "respelling": "en-KOH-mee-uhm", "partOfSpeech": "noun", "origin": "Greek", "definition": "A speech or piece of writing offering high praise.", "sentence": "His retirement drew one encomium after another." },
  { "word": "farrago", "tier": 6, "respelling": "fuh-RAH-goh", "partOfSpeech": "noun", "origin": "Latin", "definition": "A confused mixture of things.", "sentence": "The report was a farrago of rumor and guesswork." },
  { "word": "fungible", "tier": 6, "respelling": "FUN-juh-buhl", "partOfSpeech": "adjective", "origin": "Latin", "definition": "Replaceable by another identical item.", "sentence": "Barrels of oil are fungible goods." },
  { "word": "gravamen", "tier": 6, "respelling": "gruh-VAY-muhn", "partOfSpeech": "noun", "origin": "Latin", "definition": "The essential grounds of a complaint.", "sentence": "The gravamen of her case was simple." },
  { "word": "hebetude", "tier": 6, "respelling": "HEB-ih-tood", "partOfSpeech": "noun", "origin": "Latin", "definition": "The state of being dull or lethargic.", "sentence": "A long winter of hebetude finally lifted." },
  { "word": "internecine", "tier": 6, "respelling": "in-ter-NES-een", "partOfSpeech": "adjective", "origin": "Latin", "definition": "Destructive to both sides in a conflict.", "sentence": "Internecine feuding wrecked the party." },
  { "word": "jeremiad", "tier": 6, "respelling": "jair-uh-MY-uhd", "partOfSpeech": "noun", "origin": "Hebrew", "definition": "A long, mournful complaint or lament.", "sentence": "The column read like a jeremiad about modern life.", "notes": "From the prophet Jeremiah." },
  { "word": "lacuna", "tier": 6, "respelling": "luh-KYOO-nuh", "partOfSpeech": "noun", "origin": "Latin", "definition": "An unfilled gap or missing portion.", "sentence": "There is a lacuna in the manuscript." },
  { "word": "lambent", "tier": 6, "respelling": "LAM-buhnt", "partOfSpeech": "adjective", "origin": "Latin", "definition": "Glowing or flickering with a soft radiance.", "sentence": "Lambent firelight filled the cabin." },
  { "word": "litotes", "tier": 6, "respelling": "LY-tuh-teez", "partOfSpeech": "noun", "origin": "Greek", "definition": "Understatement achieved by denying the opposite.", "sentence": "Saying not bad when you mean excellent is litotes." },
  { "word": "nugatory", "tier": 6, "respelling": "NOO-guh-tor-ee", "partOfSpeech": "adjective", "origin": "Latin", "definition": "Of no value or importance.", "sentence": "The objection proved nugatory." },
  { "word": "obloquy", "tier": 6, "respelling": "OB-luh-kwee", "partOfSpeech": "noun", "origin": "Latin", "definition": "Strong public criticism or verbal abuse.", "sentence": "The decision brought him years of obloquy." },
  { "word": "palimpsest", "tier": 6, "respelling": "PAL-imp-sest", "partOfSpeech": "noun", "origin": "Greek", "definition": "A manuscript reused after earlier writing was erased, or anything bearing traces of an earlier form.", "sentence": "The city is a palimpsest of older streets." },
  { "word": "peripatetic", "tier": 6, "respelling": "pair-uh-puh-TET-ik", "partOfSpeech": "adjective", "origin": "Greek", "definition": "Traveling from place to place.", "sentence": "He led a peripatetic life as a consultant." }
]
