[
  { "word": "rhythm", "tier": 1, "respelling": "RITH-uhm", "partOfSpeech": "noun", "origin": "Greek", "definition": "A strong, regular, repeated pattern of sound or movement.", "sentence": "The drummer kept a steady rhythm all night." },
  { "word": "calendar", "tier": 1, "respelling": "KAL-uhn-der", "partOfSpeech": "noun", "origin": "Latin", "definition": "A chart showing the days, weeks, and months of a year.", "sentence": "She marked her dentist appointment on the calendar." },
  { "word": "separate", "tier": 1, "respelling": "SEP-uh-rayt", "partOfSpeech": "verb", "origin": "Latin", "definition": "To move or keep apart.", "sentence": "Please separate the recycling from the trash." },
  { "word": "embarrass", "tier": 1, "respelling": "em-BAIR-uhs", "partOfSpeech": "verb", "origin": "French", "definition": "To make someone feel awkward or ashamed.", "sentence": "He didn't mean to embarrass her in front of the class." },
  { "word": "privilege", "tier": 1, "respelling": "PRIV-uh-lij", "partOfSpeech": "noun", "origin": "Latin", "definition": "A special right or advantage granted to a person or group.", "sentence": "Driving is a privilege, not a right." },
  { "word": "definitely", "tier": 1, "respelling": "DEF-uh-nit-lee", "partOfSpeech": "adverb", "origin": "Latin", "definition": "Without any doubt.", "sentence": "She is definitely coming to dinner." },
  { "word": "necessary", "tier": 1, "respelling": "NES-uh-sair-ee", "partOfSpeech": "adjective", "origin": "Latin", "definition": "Required in order to achieve something.", "sentence": "Bring only what is necessary for the hike." },
  { "word": "occasion", "tier": 1, "respelling": "uh-KAY-zhuhn", "partOfSpeech": "noun", "origin": "Latin", "definition": "A particular time when something happens, or a special event.", "sentence": "He wore his best suit for the occasion." },
  { "word": "restaurant", "tier": 1, "respelling": "RES-tuh-rahnt", "partOfSpeech": "noun", "origin": "French", "definition": "A place where meals are prepared and served to customers.", "sentence": "They tried the new Thai restaurant downtown." },
  { "word": "weird", "tier": 1, "respelling": "WEERD", "partOfSpeech": "adjective", "origin": "Old English", "definition": "Strange or unusual in an unsettling way.", "sentence": "A weird noise came from the attic." },
  { "word": "lightning", "tier": 1, "respelling": "LYT-ning", "partOfSpeech": "noun", "origin": "Old English", "definition": "A flash of light produced by electricity during a storm.", "sentence": "Lightning lit up the whole valley.", "notes": "Do not confuse with 'lightening', meaning making lighter." },
  { "word": "vegetable", "tier": 1, "respelling": "VEJ-tuh-buhl", "partOfSpeech": "noun", "origin": "Latin", "definition": "A plant, or part of a plant, eaten as food.", "sentence": "He grows every vegetable in his own garden." },
  { "word": "cemetery", "tier": 1, "respelling": "SEM-uh-tair-ee", "partOfSpeech": "noun", "origin": "Greek", "definition": "A burial ground for the dead.", "sentence": "The old cemetery sits on a hill above town." },
  { "word": "argument", "tier": 1, "respelling": "AHR-gyuh-muhnt", "partOfSpeech": "noun", "origin": "Latin", "definition": "A disagreement expressed in words.", "sentence": "They had a brief argument about the bill." },
  { "word": "jewelry", "tier": 1, "respelling": "JOO-uhl-ree", "partOfSpeech": "noun", "origin": "French", "definition": "Ornaments such as rings and necklaces worn on the body.", "sentence": "She keeps her jewelry in a wooden box.", "alsoAccepted": ["jewellery"], "notes": "British spelling 'jewellery' is a legitimate variant. Decide in advance whether to allow it." },
  { "word": "grateful", "tier": 1, "respelling": "GRAYT-fuhl", "partOfSpeech": "adjective", "origin": "Latin", "definition": "Feeling or showing thanks.", "sentence": "We are grateful for your help." },
  { "word": "guarantee", "tier": 1, "respelling": "gair-uhn-TEE", "partOfSpeech": "noun", "origin": "French", "definition": "A formal promise that something will be done or will work.", "sentence": "The tools come with a lifetime guarantee." },
  { "word": "height", "tier": 1, "respelling": "HYT", "partOfSpeech": "noun", "origin": "Old English", "definition": "The measurement of something from bottom to top.", "sentence": "Please write your height on the form." },
  { "word": "scissors", "tier": 1, "respelling": "SIZ-erz", "partOfSpeech": "noun", "origin": "Latin", "definition": "A cutting tool with two blades joined in the middle.", "sentence": "He cut the ribbon with a pair of scissors." },
  { "word": "surprise", "tier": 1, "respelling": "ser-PRYZ", "partOfSpeech": "noun", "origin": "French", "definition": "Something unexpected.", "sentence": "Her visit was a wonderful surprise." },
  { "word": "column", "tier": 1, "respelling": "KOL-uhm", "partOfSpeech": "noun", "origin": "Latin", "definition": "An upright pillar, or a vertical division on a page.", "sentence": "A marble column held up the porch roof." },
  { "word": "thorough", "tier": 1, "respelling": "THUR-oh", "partOfSpeech": "adjective", "origin": "Old English", "definition": "Complete with regard to every detail.", "sentence": "The inspector gave the house a thorough review.", "notes": "Distinguish clearly from 'through' and 'though' when pronouncing." },
  { "word": "twelfth", "tier": 1, "respelling": "TWELFTH", "partOfSpeech": "adjective", "origin": "Old English", "definition": "Coming after the eleventh in a sequence.", "sentence": "This is the twelfth year of the festival." },
  { "word": "souvenir", "tier": 1, "respelling": "soo-vuh-NEER", "partOfSpeech": "noun", "origin": "French", "definition": "An object kept as a reminder of a place or event.", "sentence": "She bought a small souvenir at the museum." },
  { "word": "February", "tier": 1, "respelling": "FEB-roo-air-ee", "partOfSpeech": "noun", "origin": "Latin", "definition": "The second month of the year.", "sentence": "Her birthday falls in early February." }
]
