[
  {"word":"acciaccatura","tier":8,"respelling":"uh-chah-kuh-TOOR-uh","partOfSpeech":"noun","origin":"Italian","definition":"A very short grace note played just before a principal note.","sentence":"She added an acciaccatura to the phrase."},
  {"word":"agathokakological","tier":8,"respelling":"ag-uh-thoh-kak-uh-LOJ-ih-kuhl","partOfSpeech":"adjective","origin":"Greek","definition":"Composed of both good and evil.","sentence":"He described human nature as agathokakological."},
  {"word":"appoggiatura","tier":8,"respelling":"uh-poj-uh-TOOR-uh","partOfSpeech":"noun","origin":"Italian","definition":"A grace note that takes time from the note it precedes.","sentence":"The appoggiatura gives the melody its ache."},
  {"word":"brachistochrone","tier":8,"respelling":"bruh-KIS-tuh-krohn","partOfSpeech":"noun","origin":"Greek","definition":"The curve along which an object descends between two points in the shortest time.","sentence":"The brachistochrone problem launched a new branch of mathematics."},
  {"word":"chrestomathy","tier":8,"respelling":"kres-TOM-uh-thee","partOfSpeech":"noun","origin":"Greek","definition":"A collection of passages used in learning a language.","sentence":"The professor compiled a chrestomathy of medieval verse."},
  {"word":"coelacanth","tier":8,"respelling":"SEE-luh-kanth","partOfSpeech":"noun","origin":"Greek","definition":"A primitive deep-water fish once believed to be extinct.","sentence":"A live coelacanth was caught off South Africa in 1938."},
  {"word":"epexegesis","tier":8,"respelling":"ep-ek-sih-JEE-sis","partOfSpeech":"noun","origin":"Greek","definition":"The addition of words to clarify an earlier statement.","sentence":"The footnote is pure epexegesis."},
  {"word":"erysipelas","tier":8,"respelling":"air-uh-SIP-uh-luhs","partOfSpeech":"noun","origin":"Greek","definition":"A bacterial skin infection causing raised red patches.","sentence":"Erysipelas was once a common hospital scourge."},
  {"word":"eudaemonic","tier":8,"respelling":"yoo-dih-MON-ik","partOfSpeech":"adjective","origin":"Greek","definition":"Relating to happiness achieved through living well.","sentence":"The philosopher defended a eudaemonic view of the good life.","alsoAccepted":["eudaimonic","eudemonic"],"notes":"All three spellings are in standard dictionaries. Warn the speller or accept any."},
  {"word":"floccinaucinihilipilification","tier":8,"respelling":"flok-sih-naw-sih-ny-hil-ih-pil-ih-fih-KAY-shuhn","partOfSpeech":"noun","origin":"Latin","definition":"The act of judging something to be worthless.","sentence":"His floccinaucinihilipilification of the proposal was total.","notes":"Twenty-nine letters. Save it for a laugh, or drop it if you'd rather keep round 8 serious."},
  {"word":"gnotobiotic","tier":8,"respelling":"noh-toh-by-OT-ik","partOfSpeech":"adjective","origin":"Greek","definition":"Relating to organisms raised in a germ-free environment.","sentence":"The lab maintains a gnotobiotic colony."},
  {"word":"guilloche","tier":8,"respelling":"gee-YOHSH","partOfSpeech":"noun","origin":"French","definition":"An ornamental pattern of interlacing curved bands.","sentence":"Banknotes often use a guilloche to deter forgery."},
  {"word":"hendecasyllabic","tier":8,"respelling":"hen-dek-uh-suh-LAB-ik","partOfSpeech":"adjective","origin":"Greek","definition":"Consisting of eleven syllables.","sentence":"Catullus favored a hendecasyllabic line."},
  {"word":"hypnopompic","tier":8,"respelling":"hip-nuh-POM-pik","partOfSpeech":"adjective","origin":"Greek","definition":"Relating to the drowsy state just before waking.","sentence":"She recorded her hypnopompic impressions each morning."},
  {"word":"logomachy","tier":8,"respelling":"loh-GOM-uh-kee","partOfSpeech":"noun","origin":"Greek","definition":"A dispute about words rather than substance.","sentence":"The debate degenerated into logomachy."},
  {"word":"nudiustertian","tier":8,"respelling":"noo-dee-uh-STER-shuhn","partOfSpeech":"adjective","origin":"Latin","definition":"Relating to the day before yesterday.","sentence":"A nudiustertian entry in the diary mentions a storm."},
  {"word":"parrhesia","tier":8,"respelling":"puh-REE-zee-uh","partOfSpeech":"noun","origin":"Greek","definition":"Frank and fearless speech.","sentence":"The essay is a model of parrhesia."},
  {"word":"pleochroism","tier":8,"respelling":"plee-OK-roh-iz-uhm","partOfSpeech":"noun","origin":"Greek","definition":"The property of showing different colors when viewed from different angles.","sentence":"The crystal's pleochroism confirmed the mineral."},
  {"word":"psilanthropism","tier":8,"respelling":"sy-LAN-thruh-piz-uhm","partOfSpeech":"noun","origin":"Greek","definition":"The doctrine that Christ was a man and nothing more.","sentence":"The council condemned psilanthropism as heresy."},
  {"word":"schistosomiasis","tier":8,"respelling":"shis-tuh-soh-MY-uh-sis","partOfSpeech":"noun","origin":"Greek","definition":"A disease caused by parasitic flatworms found in fresh water.","sentence":"Schistosomiasis remains endemic near the river."},
  {"word":"sphygmomanometer","tier":8,"respelling":"sfig-moh-muh-NOM-ih-ter","partOfSpeech":"noun","origin":"Greek","definition":"An instrument for measuring blood pressure.","sentence":"The nurse wrapped the sphygmomanometer around his arm."},
  {"word":"succedaneum","tier":8,"respelling":"suk-sih-DAY-nee-uhm","partOfSpeech":"noun","origin":"Latin","definition":"A substitute, especially for a medicine.","sentence":"Chicory served as a coffee succedaneum."},
  {"word":"syzygy","tier":8,"respelling":"SIZ-ih-jee","partOfSpeech":"noun","origin":"Greek","definition":"An alignment of three celestial bodies in a straight line.","sentence":"A solar eclipse occurs at syzygy."},
  {"word":"tsutsugamushi","tier":8,"respelling":"tsoo-tsoo-guh-MOO-shee","partOfSpeech":"noun","origin":"Japanese","definition":"A mite-borne fever also known as scrub typhus.","sentence":"Tsutsugamushi spread among the troops in the Pacific."},
  {"word":"weltschmerz","tier":8,"respelling":"VELT-shmairts","partOfSpeech":"noun","origin":"German","definition":"World-weariness; sadness at the state of the world.","sentence":"A mood of weltschmerz runs through the poems."}
]
