[
  { "word": "sacrilegious", "tier": 4, "respelling": "sak-ruh-LIJ-uhs", "partOfSpeech": "adjective", "origin": "Latin", "definition": "Showing disrespect toward something held sacred.", "sentence": "Wearing a hat inside felt sacrilegious to her.", "notes": "The trap: it is not spelled like 'religious'." },
  { "word": "millennium", "tier": 4, "respelling": "mih-LEN-ee-uhm", "partOfSpeech": "noun", "origin": "Latin", "definition": "A period of one thousand years.", "sentence": "The cathedral has stood for nearly a millennium." },
  { "word": "inoculate", "tier": 4, "respelling": "ih-NOK-yuh-layt", "partOfSpeech": "verb", "origin": "Latin", "definition": "To treat with a vaccine in order to produce immunity.", "sentence": "The clinic will inoculate the whole class." },
  { "word": "minuscule", "tier": 4, "respelling": "MIN-uh-skyool", "partOfSpeech": "adjective", "origin": "Latin", "definition": "Extremely small.", "sentence": "The print on the contract was minuscule.", "notes": "'Miniscule' is a very common misspelling; rule it incorrect unless you decide otherwise beforehand." },
  { "word": "vacuum", "tier": 4, "respelling": "VAK-yoom", "partOfSpeech": "noun", "origin": "Latin", "definition": "A space entirely empty of matter.", "sentence": "Sound cannot travel through a vacuum." },
  { "word": "acquiesce", "tier": 4, "respelling": "ak-wee-ES", "partOfSpeech": "verb", "origin": "Latin", "definition": "To accept something reluctantly and without protest.", "sentence": "He chose to acquiesce rather than argue." },
  { "word": "anemone", "tier": 4, "respelling": "uh-NEM-uh-nee", "partOfSpeech": "noun", "origin": "Greek", "definition": "A plant with brightly colored flowers, or a soft-bodied sea creature.", "sentence": "A sea anemone clung to the rock." },
  { "word": "bellwether", "tier": 4, "respelling": "BEL-weth-er", "partOfSpeech": "noun", "origin": "English", "definition": "Something that indicates a coming trend.", "sentence": "That county is a bellwether in every election.", "notes": "Not 'weather'. Named for the lead sheep that wore a bell." },
  { "word": "bivouac", "tier": 4, "respelling": "BIV-oo-ak", "partOfSpeech": "noun", "origin": "German", "definition": "A temporary camp made without tents or permanent cover.", "sentence": "The climbers made a bivouac below the ridge." },
  { "word": "cacophony", "tier": 4, "respelling": "kuh-KOF-uh-nee", "partOfSpeech": "noun", "origin": "Greek", "definition": "A harsh, discordant mixture of sounds.", "sentence": "A cacophony of horns filled the street." },
  { "word": "chicanery", "tier": 4, "respelling": "shih-KAY-nuh-ree", "partOfSpeech": "noun", "origin": "French", "definition": "The use of trickery to achieve a goal.", "sentence": "The deal collapsed amid legal chicanery." },
  { "word": "desiccate", "tier": 4, "respelling": "DES-ih-kayt", "partOfSpeech": "verb", "origin": "Latin", "definition": "To dry out thoroughly.", "sentence": "The wind will desiccate the soil by August." },
  { "word": "diaphanous", "tier": 4, "respelling": "dy-AF-uh-nuhs", "partOfSpeech": "adjective", "origin": "Greek", "definition": "So delicate and fine as to be nearly transparent.", "sentence": "She wore a diaphanous scarf." },
  { "word": "dichotomy", "tier": 4, "respelling": "dy-KOT-uh-mee", "partOfSpeech": "noun", "origin": "Greek", "definition": "A division into two sharply contrasted parts.", "sentence": "He rejected the dichotomy between art and science." },
  { "word": "effervescent", "tier": 4, "respelling": "ef-er-VES-uhnt", "partOfSpeech": "adjective", "origin": "Latin", "definition": "Bubbling, or lively and enthusiastic.", "sentence": "Her effervescent mood lifted the room." },
  { "word": "ephemeral", "tier": 4, "respelling": "ih-FEM-er-uhl", "partOfSpeech": "adjective", "origin": "Greek", "definition": "Lasting for a very short time.", "sentence": "Fame can be ephemeral." },
  { "word": "exacerbate", "tier": 4, "respelling": "ig-ZAS-er-bayt", "partOfSpeech": "verb", "origin": "Latin", "definition": "To make a problem worse.", "sentence": "Shouting will only exacerbate the situation." },
  { "word": "hemorrhage", "tier": 4, "respelling": "HEM-uh-rij", "partOfSpeech": "noun", "origin": "Greek", "definition": "A heavy discharge of blood from a vessel.", "sentence": "Doctors worked to stop the hemorrhage.", "alsoAccepted": ["haemorrhage"] },
  { "word": "kaleidoscope", "tier": 4, "respelling": "kuh-LY-duh-skohp", "partOfSpeech": "noun", "origin": "Greek", "definition": "A tube containing mirrors and colored pieces that form changing patterns.", "sentence": "The market was a kaleidoscope of color." },
  { "word": "nomenclature", "tier": 4, "respelling": "NOH-muhn-klay-cher", "partOfSpeech": "noun", "origin": "Latin", "definition": "A system of names used in a particular field of study.", "sentence": "Botanical nomenclature follows strict rules." },
  { "word": "onomatopoeia", "tier": 4, "respelling": "on-uh-mat-uh-PEE-uh", "partOfSpeech": "noun", "origin": "Greek", "definition": "The formation of a word that imitates the sound it describes.", "sentence": "The word buzz is a classic example of onomatopoeia." },
  { "word": "proselytize", "tier": 4, "respelling": "PROS-uh-luh-tyz", "partOfSpeech": "verb", "origin": "Greek", "definition": "To try to convert someone to a belief or opinion.", "sentence": "He came to discuss, not to proselytize.", "alsoAccepted": ["proselytise"] },
  { "word": "raconteur", "tier": 4, "respelling": "rak-on-TUR", "partOfSpeech": "noun", "origin": "French", "definition": "A person skilled at telling anecdotes.", "sentence": "Her uncle was a marvelous raconteur." },
  { "word": "schadenfreude", "tier": 4, "respelling": "SHAH-duhn-froy-duh", "partOfSpeech": "noun", "origin": "German", "definition": "Pleasure taken in another person's misfortune.", "sentence": "He felt a flicker of schadenfreude at the news." },
  { "word": "sycophant", "tier": 4, "respelling": "SIK-uh-fuhnt", "partOfSpeech": "noun", "origin": "Greek", "definition": "A person who flatters others to gain advantage.", "sentence": "The king was surrounded by sycophants." }
]
