[
  {"word":"anacoluthon","tier":7,"respelling":"an-uh-kuh-LOO-thon","partOfSpeech":"noun","origin":"Greek","definition":"An abrupt change of grammatical construction within a sentence.","sentence":"The speech was riddled with anacoluthon."},
  {"word":"apotropaic","tier":7,"respelling":"ap-uh-truh-PAY-ik","partOfSpeech":"adjective","origin":"Greek","definition":"Intended to ward off evil.","sentence":"The carved faces served an apotropaic purpose."},
  {"word":"autochthonous","tier":7,"respelling":"aw-TOK-thuh-nuhs","partOfSpeech":"adjective","origin":"Greek","definition":"Originating where it is found; native to a place.","sentence":"The ferns are autochthonous to the island."},
  {"word":"borborygmus","tier":7,"respelling":"bor-buh-RIG-muhs","partOfSpeech":"noun","origin":"Greek","definition":"A rumbling noise made by gas moving through the intestines.","sentence":"An audible borborygmus interrupted the silence."},
  {"word":"chthonic","tier":7,"respelling":"THON-ik","partOfSpeech":"adjective","origin":"Greek","definition":"Relating to the underworld beneath the earth.","sentence":"The myth describes a chthonic realm of shadows.","notes":"Also pronounced KTHON-ik."},
  {"word":"deipnosophist","tier":7,"respelling":"dyp-NOS-uh-fist","partOfSpeech":"noun","origin":"Greek","definition":"A person skilled at conversation over dinner.","sentence":"Her grandfather was a legendary deipnosophist."},
  {"word":"kakistocracy","tier":7,"respelling":"kak-ih-STOK-ruh-see","partOfSpeech":"noun","origin":"Greek","definition":"Government by the least qualified people.","sentence":"He dismissed the council as a kakistocracy."},
  {"word":"oubliette","tier":7,"respelling":"oo-blee-ET","partOfSpeech":"noun","origin":"French","definition":"A secret dungeon reached only through a trapdoor above.","sentence":"The castle tour ended at the oubliette."},
  {"word":"pasquinade","tier":7,"respelling":"pas-kwih-NAYD","partOfSpeech":"noun","origin":"Italian","definition":"A satire or lampoon posted in a public place.","sentence":"A pasquinade appeared on the palace door."},
  {"word":"prosopagnosia","tier":7,"respelling":"pros-uh-pag-NOH-zhuh","partOfSpeech":"noun","origin":"Greek","definition":"An inability to recognize faces.","sentence":"Prosopagnosia made family reunions difficult for him."},
  {"word":"psephology","tier":7,"respelling":"sih-FOL-uh-jee","partOfSpeech":"noun","origin":"Greek","definition":"The statistical study of elections and voting.","sentence":"Psephology became a nightly television spectacle."},
  {"word":"quincunx","tier":7,"respelling":"KWIN-kunks","partOfSpeech":"noun","origin":"Latin","definition":"An arrangement of five objects, four at the corners of a square and one in the middle.","sentence":"The orchard was planted in a quincunx."},
  {"word":"rebarbative","tier":7,"respelling":"rih-BAHR-buh-tiv","partOfSpeech":"adjective","origin":"French","definition":"Unattractive and objectionable.","sentence":"The building's rebarbative front drew complaints."},
  {"word":"sesquipedalian","tier":7,"respelling":"ses-kwih-puh-DAY-lee-uhn","partOfSpeech":"adjective","origin":"Latin","definition":"Given to using very long words.","sentence":"His sesquipedalian prose exhausted the reader."},
  {"word":"sinecure","tier":7,"respelling":"SY-nih-kyoor","partOfSpeech":"noun","origin":"Latin","definition":"A position requiring little work but providing income.","sentence":"The board seat was a comfortable sinecure."},
  {"word":"solipsism","tier":7,"respelling":"SOL-ip-siz-uhm","partOfSpeech":"noun","origin":"Latin","definition":"The view that only one's own mind is certain to exist.","sentence":"The novel drifts into pure solipsism."},
  {"word":"stichomythia","tier":7,"respelling":"stik-uh-MITH-ee-uh","partOfSpeech":"noun","origin":"Greek","definition":"Dialogue delivered in alternating single lines.","sentence":"The scene's stichomythia quickens the pace."},
  {"word":"tergiversate","tier":7,"respelling":"TER-jih-ver-sayt","partOfSpeech":"verb","origin":"Latin","definition":"To make conflicting statements, or to change one's position evasively.","sentence":"The witness began to tergiversate under questioning."},
  {"word":"tintinnabulation","tier":7,"respelling":"tin-tih-nab-yuh-LAY-shuhn","partOfSpeech":"noun","origin":"Latin","definition":"The ringing or sound of bells.","sentence":"The tintinnabulation of the chapel carried across the fields."},
  {"word":"ultracrepidarian","tier":7,"respelling":"uhl-truh-krep-ih-DAIR-ee-uhn","partOfSpeech":"adjective","origin":"Latin","definition":"Giving opinions on matters beyond one's knowledge.","sentence":"The panel was full of ultracrepidarian pundits."},
  {"word":"valetudinarian","tier":7,"respelling":"val-ih-too-dih-NAIR-ee-uhn","partOfSpeech":"noun","origin":"Latin","definition":"A person unduly anxious about their own health.","sentence":"He became a valetudinarian in his forties."},
  {"word":"vexillology","tier":7,"respelling":"vek-sih-LOL-uh-jee","partOfSpeech":"noun","origin":"Latin","definition":"The study of flags.","sentence":"Vexillology has a surprisingly devoted following."},
  {"word":"widdershins","tier":7,"respelling":"WID-er-shinz","partOfSpeech":"adverb","origin":"German","definition":"In a direction contrary to the sun's course; counterclockwise.","sentence":"They walked widdershins around the stone.","alsoAccepted":["withershins"]},
  {"word":"zugzwang","tier":7,"respelling":"TSOOK-tsvahng","partOfSpeech":"noun","origin":"German","definition":"A situation in which every available move worsens one's position.","sentence":"White was in zugzwang by move thirty."},
  {"word":"zymurgy","tier":7,"respelling":"ZY-mer-jee","partOfSpeech":"noun","origin":"Greek","definition":"The branch of chemistry dealing with fermentation.","sentence":"He studied zymurgy before opening the brewery."}
]
